{
  "schemaVersion": 1,
  "manifestType": "world-builder-current-module-set",
  "platformReleaseId": "current-platform-v2",
  "platformManifestHash": "0f5de4f947b5864ced91ef3865daa318c952070362044acb05a7a938830ebe4c",
  "variantId": "current-advanced-v1",
  "variantManifestHash": "353860a8b4e7dac815df1888725dd647f43e6f091e770cda1c3029f373b52a31",
  "modules": [
    {
      "order": 0,
      "moduleId": "advanced-gameplay-v1",
      "moduleVersion": "1.0.0",
      "moduleKind": "server-client-feature",
      "platformApiVersion": "current-platform-api-v1",
      "moduleManifestHash": "aaaaaaaaaaaaaaaaaaaaaaaaaaaaaaaaaaaaaaaaaaaaaaaaaaaaaaaaaaaaaaaa",
      "modulePayloadRootHash": "bbbbbbbbbbbbbbbbbbbbbbbbbbbbbbbbbbbbbbbbbbbbbbbbbbbbbbbbbbbbbbbb",
      "dependencies": [],
      "conflicts": [],
      "clientPairing": "required",
      "configurationNamespace": "advanced.gameplay",
      "stateMigrationIds": ["advanced-state-v1"],
      "provenance": "provider"
    }
  ],
  "moduleSetHash": "de37850b397d081e76b48182b32a00356d2635536fc1138f532ec24e63a01ab1",
  "bundleInventoryHash": "cccccccccccccccccccccccccccccccccccccccccccccccccccccccccccccccc"
}
